{
  "id": "evt_campaign.mail_tracking.rts_update_campaign_fixture_partner_2026071415_abc123",
  "type": "campaign.mail_tracking.rts_update",
  "version": "2026-02-01",
  "created_at": "2026-07-14T15:00:00+00:00",
  "data": {
    "campaign_id": "campaign_fixture_partner",
    "mail_status": "in_transit",
    "total_pieces": 500,
    "scanned_pieces": 475,
    "scan_coverage": 95.0,
    "delivered": 375,
    "in_transit": 50,
    "out_for_delivery": 25,
    "rts": 50,
    "forwarded": 5,
    "delivered_rate": 75.0,
    "rts_rate": 10.0,
    "first_scan_at": "2026-07-10T12:00:00+00:00",
    "last_scan_at": "2026-07-14T14:00:00+00:00",
    "integration": {
      "source": "propstream",
      "external_account_id": "tenant_fixture",
      "external_user_id": "user_fixture_42",
      "external_id": "campaign_external_fixture"
    },
    "new_rts_pieces": [
      {
        "piece_id": "476677ce9cd66b9b843abc83",
        "status": "RTS",
        "recipient_name": "Fixture Recipient 001",
        "recipient_address": "1001 Example Ave",
        "recipient_city": "Austin",
        "recipient_state": "TX",
        "recipient_zip": "78701",
        "last_scan_at": "2026-07-14T14:00:00+00:00",
        "contact_id": "contact_fixture_001",
        "contact_type": "PROPERTY"
      },
      {
        "piece_id": "ddecb00f920423e9dcab9375",
        "status": "RTS",
        "recipient_name": "Fixture Recipient 002",
        "recipient_address": "1002 Example Ave",
        "recipient_city": "Austin",
        "recipient_state": "TX",
        "recipient_zip": "78702",
        "last_scan_at": "2026-07-14T14:00:00+00:00",
        "contact_id": "contact_fixture_002",
        "contact_type": "MAILING"
      },
      {
        "piece_id": "17c22b7bc790eca075799dd7",
        "status": "RTS",
        "recipient_name": "Fixture Recipient 003",
        "recipient_address": "1003 Example Ave",
        "recipient_city": "Austin",
        "recipient_state": "TX",
        "recipient_zip": "78703",
        "last_scan_at": "2026-07-14T14:00:00+00:00",
        "contact_id": "contact_fixture_003",
        "contact_type": "PROPERTY"
      },
      {
        "piece_id": "48de5ae7188d983ef2b9b9eb",
        "status": "RTS",
        "recipient_name": "Fixture Recipient 004",
        "recipient_address": "1004 Example Ave",
        "recipient_city": "Austin",
        "recipient_state": "TX",
        "recipient_zip": "78704",
        "last_scan_at": "2026-07-14T14:00:00+00:00",
        "contact_id": "contact_fixture_004",
        "contact_type": "MAILING"
      },
      {
        "piece_id": "a726bedb4dd45fdcd5e80ded",
        "status": "RTS",
        "recipient_name": "Fixture Recipient 005",
        "recipient_address": "1005 Example Ave",
        "recipient_city": "Austin",
        "recipient_state": "TX",
        "recipient_zip": "78705",
        "last_scan_at": "2026-07-14T14:00:00+00:00",
        "contact_id": "contact_fixture_005",
        "contact_type": "PROPERTY"
      },
      {
        "piece_id": "b1f3dad92503ece38be65660",
        "status": "RTS",
        "recipient_name": "Fixture Recipient 006",
        "recipient_address": "1006 Example Ave",
        "recipient_city": "Austin",
        "recipient_state": "TX",
        "recipient_zip": "78706",
        "last_scan_at": "2026-07-14T14:00:00+00:00",
        "contact_id": "contact_fixture_006",
        "contact_type": "MAILING"
      },
      {
        "piece_id": "935a087d7c42b2c689c49ce7",
        "status": "RTS",
        "recipient_name": "Fixture Recipient 007",
        "recipient_address": "1007 Example Ave",
        "recipient_city": "Austin",
        "recipient_state": "TX",
        "recipient_zip": "78707",
        "last_scan_at": "2026-07-14T14:00:00+00:00",
        "contact_id": "contact_fixture_007",
        "contact_type": "PROPERTY"
      },
      {
        "piece_id": "b713aca18184e67905a3789c",
        "status": "RTS",
        "recipient_name": "Fixture Recipient 008",
        "recipient_address": "1008 Example Ave",
        "recipient_city": "Austin",
        "recipient_state": "TX",
        "recipient_zip": "78708",
        "last_scan_at": "2026-07-14T14:00:00+00:00",
        "contact_id": "contact_fixture_008",
        "contact_type": "MAILING"
      },
      {
        "piece_id": "2b20a3dc88e8430d33198e86",
        "status": "RTS",
        "recipient_name": "Fixture Recipient 009",
        "recipient_address": "1009 Example Ave",
        "recipient_city": "Austin",
        "recipient_state": "TX",
        "recipient_zip": "78709",
        "last_scan_at": "2026-07-14T14:00:00+00:00",
        "contact_id": "contact_fixture_009",
        "contact_type": "PROPERTY"
      },
      {
        "piece_id": "88d2adc99ca8d6c91d1e5bf1",
        "status": "RTS",
        "recipient_name": "Fixture Recipient 010",
        "recipient_address": "1010 Example Ave",
        "recipient_city": "Austin",
        "recipient_state": "TX",
        "recipient_zip": "78710",
        "last_scan_at": "2026-07-14T14:00:00+00:00",
        "contact_id": "contact_fixture_010",
        "contact_type": "MAILING"
      },
      {
        "piece_id": "49bfa079ca1de74377ae4cb6",
        "status": "RTS",
        "recipient_name": "Fixture Recipient 011",
        "recipient_address": "1011 Example Ave",
        "recipient_city": "Austin",
        "recipient_state": "TX",
        "recipient_zip": "78711",
        "last_scan_at": "2026-07-14T14:00:00+00:00",
        "contact_id": "contact_fixture_011",
        "contact_type": "PROPERTY"
      },
      {
        "piece_id": "58a878a34406cc346c63f050",
        "status": "RTS",
        "recipient_name": "Fixture Recipient 012",
        "recipient_address": "1012 Example Ave",
        "recipient_city": "Austin",
        "recipient_state": "TX",
        "recipient_zip": "78712",
        "last_scan_at": "2026-07-14T14:00:00+00:00",
        "contact_id": "contact_fixture_012",
        "contact_type": "MAILING"
      },
      {
        "piece_id": "c1cd7220a9f43bd572c393f8",
        "status": "RTS",
        "recipient_name": "Fixture Recipient 013",
        "recipient_address": "1013 Example Ave",
        "recipient_city": "Austin",
        "recipient_state": "TX",
        "recipient_zip": "78713",
        "last_scan_at": "2026-07-14T14:00:00+00:00",
        "contact_id": "contact_fixture_013",
        "contact_type": "PROPERTY"
      },
      {
        "piece_id": "7a7e3205bd32eeeae538f7c7",
        "status": "RTS",
        "recipient_name": "Fixture Recipient 014",
        "recipient_address": "1014 Example Ave",
        "recipient_city": "Austin",
        "recipient_state": "TX",
        "recipient_zip": "78714",
        "last_scan_at": "2026-07-14T14:00:00+00:00",
        "contact_id": "contact_fixture_014",
        "contact_type": "MAILING"
      },
      {
        "piece_id": "8246e2d0ee6c6b64d235cb72",
        "status": "RTS",
        "recipient_name": "Fixture Recipient 015",
        "recipient_address": "1015 Example Ave",
        "recipient_city": "Austin",
        "recipient_state": "TX",
        "recipient_zip": "78715",
        "last_scan_at": "2026-07-14T14:00:00+00:00",
        "contact_id": "contact_fixture_015",
        "contact_type": "PROPERTY"
      },
      {
        "piece_id": "e337d7a65b952b25a7254c2a",
        "status": "RTS",
        "recipient_name": "Fixture Recipient 016",
        "recipient_address": "1016 Example Ave",
        "recipient_city": "Austin",
        "recipient_state": "TX",
        "recipient_zip": "78716",
        "last_scan_at": "2026-07-14T14:00:00+00:00",
        "contact_id": "contact_fixture_016",
        "contact_type": "MAILING"
      },
      {
        "piece_id": "62f3f51c0560179d15d0edea",
        "status": "RTS",
        "recipient_name": "Fixture Recipient 017",
        "recipient_address": "1017 Example Ave",
        "recipient_city": "Austin",
        "recipient_state": "TX",
        "recipient_zip": "78717",
        "last_scan_at": "2026-07-14T14:00:00+00:00",
        "contact_id": "contact_fixture_017",
        "contact_type": "PROPERTY"
      },
      {
        "piece_id": "431a265a1d4a7dfb5c1faaab",
        "status": "RTS",
        "recipient_name": "Fixture Recipient 018",
        "recipient_address": "1018 Example Ave",
        "recipient_city": "Austin",
        "recipient_state": "TX",
        "recipient_zip": "78718",
        "last_scan_at": "2026-07-14T14:00:00+00:00",
        "contact_id": "contact_fixture_018",
        "contact_type": "MAILING"
      },
      {
        "piece_id": "6d7fab3e66362fd88df1f0bc",
        "status": "RTS",
        "recipient_name": "Fixture Recipient 019",
        "recipient_address": "1019 Example Ave",
        "recipient_city": "Austin",
        "recipient_state": "TX",
        "recipient_zip": "78719",
        "last_scan_at": "2026-07-14T14:00:00+00:00",
        "contact_id": "contact_fixture_019",
        "contact_type": "PROPERTY"
      },
      {
        "piece_id": "433df1d133ecad15dc17a5ed",
        "status": "RTS",
        "recipient_name": "Fixture Recipient 020",
        "recipient_address": "1020 Example Ave",
        "recipient_city": "Austin",
        "recipient_state": "TX",
        "recipient_zip": "78720",
        "last_scan_at": "2026-07-14T14:00:00+00:00",
        "contact_id": "contact_fixture_020",
        "contact_type": "MAILING"
      },
      {
        "piece_id": "f4a34b1d6e65b4ca49b40b79",
        "status": "RTS",
        "recipient_name": "Fixture Recipient 021",
        "recipient_address": "1021 Example Ave",
        "recipient_city": "Austin",
        "recipient_state": "TX",
        "recipient_zip": "78721",
        "last_scan_at": "2026-07-14T14:00:00+00:00",
        "contact_id": "contact_fixture_021",
        "contact_type": "PROPERTY"
      },
      {
        "piece_id": "68a7cc7fdebebd9235e588c1",
        "status": "RTS",
        "recipient_name": "Fixture Recipient 022",
        "recipient_address": "1022 Example Ave",